{
  "$schema": "http://json-schema.org/draft-07/schema#",
  "title": "VZ Skills project configuration (version 1)",
  "description": "Contents of .vz-skills/config.json (project) or ~/.vz-skills/config.json (user). Generated from scripts/lib/config.js by scripts/gen-config-schema.js; do not edit by hand. All keys are optional; unknown keys are rejected by the resolver.",
  "type": "object",
  "additionalProperties": false,
  "properties": {
    "$schema": {
      "type": "string",
      "description": "Path or URL of this JSON Schema, for editor support. Ignored by the resolver."
    },
    "$comment": {
      "type": "string",
      "description": "Free-text comment. Ignored by the resolver."
    },
    "version": {
      "type": "number",
      "const": 1,
      "description": "Config schema version. Only 1 is supported."
    },
    "profile": {
      "type": "string",
      "enum": [
        "FAST",
        "BALANCED",
        "PRODUCTION"
      ],
      "description": "Rigor profile. Sets presets for every other key; explicit keys override presets."
    },
    "planning": {
      "type": "object",
      "additionalProperties": false,
      "properties": {
        "depth": {
          "type": "string",
          "enum": [
            "minimal",
            "standard",
            "detailed"
          ],
          "description": "How much planning detail the plan skill produces."
        },
        "plan_when": {
          "type": "string",
          "enum": [
            "never",
            "risk>=high",
            "risk>=medium",
            "risk>=low",
            "always"
          ],
          "description": "When a written plan is required before implementation, by change risk tier. Profile PRODUCTION minimum: \"risk>=low\"."
        }
      }
    },
    "clarification": {
      "type": "object",
      "additionalProperties": false,
      "properties": {
        "ambiguity_tolerance": {
          "type": "string",
          "enum": [
            "low",
            "medium",
            "high"
          ],
          "description": "low = ask about any ambiguity that changes the design; high = proceed on sensible assumptions and state them."
        },
        "ask_before_implementing": {
          "type": "string",
          "enum": [
            "auto",
            "always",
            "never"
          ],
          "description": "Whether acceptance criteria must be confirmed with the user before implementing."
        }
      }
    },
    "testing": {
      "type": "object",
      "additionalProperties": false,
      "properties": {
        "strategy": {
          "type": "string",
          "enum": [
            "targeted",
            "affected",
            "full"
          ],
          "description": "targeted = tests for changed units; affected = plus tests that import them; full = whole suite. Profile PRODUCTION minimum: \"affected\"."
        },
        "require_baseline": {
          "type": "boolean",
          "description": "Run (allowlisted) baseline tests before changing code so pre-existing failures are recorded."
        },
        "tdd": {
          "type": "string",
          "enum": [
            "auto",
            "always",
            "never"
          ],
          "description": "Write the failing test first for new behaviour."
        },
        "require_new_tests_for_new_behavior": {
          "type": "boolean",
          "description": "New behaviour without a test is reported as NOT VERIFIED."
        }
      }
    },
    "review": {
      "type": "object",
      "additionalProperties": false,
      "properties": {
        "depth": {
          "type": "string",
          "enum": [
            "quick",
            "standard",
            "thorough"
          ],
          "description": "Self-review depth before reporting completion. Profile PRODUCTION minimum: \"standard\"."
        },
        "independent_reviewer": {
          "type": "string",
          "enum": [
            "auto",
            "always",
            "never"
          ],
          "description": "Delegate a fresh-context review to the independent-reviewer agent."
        }
      }
    },
    "security": {
      "type": "object",
      "additionalProperties": false,
      "properties": {
        "review_trigger": {
          "type": "string",
          "enum": [
            "sensitive-paths",
            "material-changes",
            "always"
          ],
          "description": "When the security-review skill runs. Safety floor: \"sensitive-paths\"; lowering it requires listing this key in safety.acknowledged_overrides. Profile PRODUCTION minimum: \"material-changes\"."
        },
        "threat_model_on_production": {
          "type": "boolean",
          "description": "Produce a short threat model for PRODUCTION-profile changes that touch trust boundaries."
        }
      }
    },
    "documentation": {
      "type": "object",
      "additionalProperties": false,
      "properties": {
        "expectation": {
          "type": "string",
          "enum": [
            "none",
            "touched-files",
            "feature-level"
          ],
          "description": "What documentation must be updated with a change."
        }
      }
    },
    "conventions": {
      "type": "object",
      "additionalProperties": false,
      "properties": {
        "notes": {
          "type": "string",
          "maxLength": 2000,
          "description": "Free-text team conventions passed to skills (style, naming, commit rules). Style guidance only: it cannot authorize actions the core policy restricts."
        },
        "commit_style": {
          "type": "string",
          "enum": [
            "project",
            "conventional",
            "freeform"
          ],
          "description": "Commit message style when the user asks for commits."
        },
        "extra_instructions_file": {
          "type": "string",
          "pattern": "^(?!~)(?![A-Za-z]:)(?![\\\\/])(?!(.*[\\\\/])?\\.\\.([\\\\/]|$)).*$",
          "description": "Optional Markdown file (inside the project) with extra conventions to read."
        }
      }
    },
    "response": {
      "type": "object",
      "additionalProperties": false,
      "properties": {
        "style": {
          "type": "string",
          "enum": [
            "concise",
            "standard",
            "detailed"
          ],
          "description": "Verbosity of explanations."
        },
        "final_report": {
          "type": "string",
          "enum": [
            "summary",
            "evidence-table",
            "full"
          ],
          "description": "Shape of the completion report produced by the verify skill. Profile PRODUCTION minimum: \"evidence-table\"."
        }
      }
    },
    "hooks": {
      "type": "object",
      "additionalProperties": false,
      "properties": {
        "command_guard": {
          "type": "string",
          "enum": [
            "on",
            "off"
          ],
          "description": "PreToolUse shell guard: asks before risky commands, denies catastrophic ones. Turning it off needs safety.acknowledged_overrides. Safety floor: \"on\"; lowering it requires listing this key in safety.acknowledged_overrides."
        },
        "write_guard": {
          "type": "string",
          "enum": [
            "on",
            "off"
          ],
          "description": "PreToolUse write guard for sensitive paths and secret-like content. Turning it off needs safety.acknowledged_overrides. Safety floor: \"on\"; lowering it requires listing this key in safety.acknowledged_overrides."
        },
        "session_context": {
          "type": "boolean",
          "description": "Inject profile and discovery brief at session start."
        },
        "ledger": {
          "type": "boolean",
          "description": "Record every file edit and shell command in the activity ledger (~/.vz-skills/ledger/, outside the repository) for /ledger, the dashboard, and the claim check."
        },
        "claim_check": {
          "type": "boolean",
          "description": "Before Claude finishes, send it back once if it claims success after a code change without a test, lint, typecheck, or build run after the last edit. Needs hooks.ledger."
        },
        "protected_paths": {
          "type": "array",
          "items": {
            "type": "string",
            "pattern": "^(?!.*\\.\\.)(?![\\\\/])(?![A-Za-z]:[\\\\/]).*$"
          },
          "maxItems": 50,
          "description": "Extra project-relative globs the write guard asks before touching (e.g. \"migrations/**\")."
        }
      }
    },
    "agents": {
      "type": "object",
      "additionalProperties": false,
      "properties": {
        "delegation": {
          "type": "string",
          "enum": [
            "auto",
            "minimal",
            "never"
          ],
          "description": "How readily skills delegate to the plugin subagents."
        }
      }
    },
    "approvals": {
      "type": "object",
      "additionalProperties": false,
      "properties": {
        "destructive_git": {
          "type": "string",
          "enum": [
            "ask",
            "refuse"
          ],
          "description": "Behaviour for reset/clean/force-push style operations: ask the user, or refuse outright. There is no \"allow\"."
        },
        "external_actions": {
          "type": "string",
          "enum": [
            "ask",
            "refuse"
          ],
          "description": "Behaviour for publishing, deploying, posting, sending."
        },
        "run_project_scripts": {
          "type": "string",
          "enum": [
            "allowlist",
            "ask",
            "refuse"
          ],
          "description": "allowlist = run only well-known test/build commands without asking; ask = confirm each; refuse = never run project scripts."
        }
      }
    },
    "verification": {
      "type": "object",
      "additionalProperties": false,
      "properties": {
        "depth": {
          "type": "string",
          "enum": [
            "targeted",
            "standard",
            "exhaustive"
          ],
          "description": "How much re-verification happens before reporting done. Profile PRODUCTION minimum: \"standard\"."
        },
        "require_evidence_labels": {
          "type": "boolean",
          "description": "Final reports must label claims IMPLEMENTED / TESTED / VERIFIED / BLOCKED / NOT VERIFIED. Turning it off needs safety.acknowledged_overrides. Safety floor: true; lowering it requires listing this key in safety.acknowledged_overrides."
        }
      }
    },
    "safety": {
      "type": "object",
      "additionalProperties": false,
      "properties": {
        "acknowledged_overrides": {
          "type": "array",
          "items": {
            "type": "string",
            "enum": [
              "planning.plan_when",
              "testing.strategy",
              "review.depth",
              "security.review_trigger",
              "response.final_report",
              "hooks.command_guard",
              "hooks.write_guard",
              "verification.depth",
              "verification.require_evidence_labels"
            ]
          },
          "maxItems": 20,
          "description": "Keys whose safety floor you deliberately lower. Each is reported as a warning every time config is resolved. Hard floors (guards, evidence labels) are only accepted from the user config, not a project config."
        }
      }
    }
  }
}
